{
  "schema_id": "obliteratus.checkpoint-trust-policy",
  "schema_version": "1.0.0",
  "policy_id": "policy-fixture-1",
  "operation_level": "trusted_metadata",
  "requested_state_scope": ["model_weights"],
  "adapter": {"capability_id": "dcp-metadata", "adapter_id": "fixture-reader", "adapter_version": "1.0.0", "adapter_digest": "sha256:aaaaaaaaaaaaaaaaaaaaaaaaaaaaaaaaaaaaaaaaaaaaaaaaaaaaaaaaaaaaaaaa"},
  "source": {"root_id": "source-1", "inventory_digest": "sha256:bbbbbbbbbbbbbbbbbbbbbbbbbbbbbbbbbbbbbbbbbbbbbbbbbbbbbbbbbbbbbbbb", "files": [{"file_id": "file-1", "relative_path": ".metadata", "size_bytes": 32, "sha256": "sha256:cccccccccccccccccccccccccccccccccccccccccccccccccccccccccccccccc", "observation_id": "observation-1"}]},
  "runtime": {"framework": "pytorch", "framework_version": "exact-fixture-version", "dependency_identity": "sha256:dddddddddddddddddddddddddddddddddddddddddddddddddddddddddddddddd", "runtime_digest": "sha256:eeeeeeeeeeeeeeeeeeeeeeeeeeeeeeeeeeeeeeeeeeeeeeeeeeeeeeeeeeeeeeee"},
  "isolation": {"profile_id": "disposable-linux-fixture", "profile_version": "1", "profile_digest": "sha256:ffffffffffffffffffffffffffffffffffffffffffffffffffffffffffffffff", "required_capabilities": ["unprivileged", "no_new_privs", "read_only_source", "network_denied", "resource_limits", "bounded_cleanup"]},
  "resources": {"wall_time_seconds": 30, "cpu_seconds": 20, "memory_bytes": 1073741824, "processes": 8, "threads": 32, "open_files": 128, "input_bytes": 1048576, "header_bytes": 65536, "message_bytes": 1048576, "scratch_bytes": 1048576, "output_bytes": 0},
  "output": {"root_id": null, "staging_policy": "none"},
  "authorization": {"event_id": "authorization-fixture-1", "actor_role": "checkpoint-security-operator", "created_at": "2026-09-02T12:00:00Z", "expires_at": "2026-09-02T12:05:00Z", "single_use_nonce": "0123456789abcdef0123456789abcdef", "single_use": true},
  "evidence": {"candidate_commit": "1111111111111111111111111111111111111111", "policy_digest": "sha256:9999999999999999999999999999999999999999999999999999999999999999"}
}
